{"type":"config","name":"Gemma decode tok/s optimization","metricName":"decode_tps","metricUnit":"","bestDirection":"higher"}
{"run":1,"commit":"454b553","metric":8.49,"metrics":{"prompt_tps":40.22,"wall_s":24.06},"status":"keep","description":"baseline: gemma-cli with 6 prompt tokens + 64 new tokens","timestamp":1778516048375,"segment":0,"confidence":null,"asi":{"hypothesis":"establish baseline decode tok/s","output":"Dublin completion looks correct","build_system":"mise gemma-cli (swiftbuild) — running swift build directly breaks resource bundle"}}
{"run":2,"commit":"f5fa86d","metric":8.41,"metrics":{"prompt_tps":24.14,"wall_s":42.24},"status":"discard","description":"matvec: 8 rows/simdgroup (vs 4) for N>=512","timestamp":1778516447254,"segment":0,"confidence":null,"asi":{"hypothesis":"more rows per simdgroup amortizes x loads and reduces simdgroup reductions","result":"slight regression (within noise)","likely_cause":"register pressure with 8 accumulators + 8 w_base[] indices may cause spills; also halving simdgroup count hurts occupancy","rollback_reason":"no improvement, primary slightly worse","next_action_hint":"try fewer changes: maybe just unroll inner loop / wider load (float8 = two float4 per iter) to amortize x load without changing rows count; or focus on dispatch overhead via kernel fusion"}}
{"run":3,"commit":"f5fa86d","metric":8.45,"metrics":{"prompt_tps":40.42,"wall_s":19.15},"status":"discard","description":"fused SwigluMatvec (gate+up+gelu+mul → 1 dispatch) for t=1 MLP","timestamp":1778516685769,"segment":0,"confidence":null,"asi":{"hypothesis":"saving 3 dispatches+barriers per layer (4 ops fused) would speed up decode","result":"neutral (8.45 vs 8.49 baseline; second run; first run was 8.22 likely thermal/cold)","implication":"dispatch overhead is NOT the dominant bottleneck — 105 fewer dispatches/token had no measurable effect","next_action_hint":"either real memory-bandwidth bound (matvec kernel quality matters most) OR many tiny per-kernel overheads dominate. Try fusing input read paths: AddRMSNorm to eliminate one full pass over hidden state. Also try profiling kernels via signpost timestamps to know where time goes."}}
{"run":4,"commit":"f5fa86d","metric":8.51,"metrics":{"prompt_tps":25.49,"wall_s":37.6},"status":"discard","description":"matvec inner-loop 2× unroll (process 2 float4 per lane per iter)","timestamp":1778516827288,"segment":0,"confidence":null,"asi":{"hypothesis":"doubled ILP per iteration would speed matvec","result":"neutral (8.51 vs 8.49)","implication":"compiler likely already unrolls; not the bottleneck","rollback_reason":"no improvement","next_action_hint":"try simd_sum-based reduction in RMSNorm (replace 8-iter barrier reduction with 1 barrier); rmsnorm runs ~11k times/decode and may dominate latency. Also worth instrumenting with GPU timestamps."}}
{"run":5,"commit":"b45b9f4","metric":10.38,"metrics":{"prompt_tps":28.21,"wall_s":38.74},"status":"keep","description":"parallel argmax_row kernel for large N (vocab argmax)","timestamp":1778516921043,"segment":0,"confidence":47.24999999999892,"asi":{"hypothesis":"single-thread serial scan over 262k logits is a major per-token bottleneck","result":"8.49 → 10.38 tok/s (+22%); output identical","implementation":"added argmax_row kernel using simd_shuffle_down + threadgroup reduction; selected when N>=1024","next_action_hint":"audit other kernels for low parallelism: RopeBuildCosSin, AttentionScoresSoftmax (1 TG per attention head, fine), AttentionOutput (Nq*Hd threads), KVCacheWrite. Also Embedding/EmbeddingGather. Look for other M=1 launches with tiny grids."}}
{"run":6,"commit":"b45b9f4","metric":10.36,"metrics":{"prompt_tps":16.8,"wall_s":19.21},"status":"discard","description":"RMSNorm with simdgroup-based reduction (1 TG barrier vs 8)","timestamp":1778517062538,"segment":0,"confidence":26.999999999999897,"asi":{"hypothesis":"fewer threadgroup barriers in RMSNorm reduce latency","result":"neutral (10.36 vs 10.38)","side_effect":"output text diverged at token 26 (numerically equivalent but different summation order changes greedy argmax). Not a correctness issue but a hint that RMSNorm reduction isn't the bottleneck.","rollback_reason":"no improvement; not worth the output drift","next_action_hint":"RMSNorm not the bottleneck. Try fusing many tiny per-layer dispatches (e.g. KNorm+RopeApply+Transpose12+KVCacheWrite into one decoder-mode K-cache write kernel). Or look at HazardTrackingEncoder barrier scope."}}
{"run":7,"commit":"b45b9f4","metric":7.78,"metrics":{"prompt_tps":36.53,"wall_s":32.38},"status":"discard","description":"use MPP matvec for transposed N>=8192 (logits, per_layer_model_projection)","timestamp":1778517166800,"segment":0,"confidence":23.624999999999986,"asi":{"hypothesis":"MPP matmul2d primitive faster than simd-shuffle matvec for huge N","result":"huge regression: 10.38 → 7.78","likely_cause":"MPP matvec uses TileM=8 which pads M=1 → 8× wasted work per row in the matrix-mul unit; simd4 matvec doesn't pad","rollback_reason":"regression","next_action_hint":"MPP is a dead end for M=1 transposed matvec. Either (a) write a custom kernel using simdgroup_matrix with explicit M=1 handling, or (b) focus elsewhere. Try fusing AttentionScoresSoftmax+AttentionOutput, fusing K/V cache write pipeline, or moving on to many-small-dispatch reduction."}}
{"run":8,"commit":"b45b9f4","metric":10.15,"metrics":{"prompt_tps":17.22,"wall_s":39.75},"status":"discard","description":"matvec simd8 (8 rows/sg) for transposed N>=8192","timestamp":1778517281216,"segment":0,"confidence":4.6666666666666705,"asi":{"hypothesis":"fewer simdgroups + amortized x loads helps for huge-N (logits) matvec","result":"slight regression 10.38 → 10.15","likely_cause":"register pressure with 8 accumulators or worse cache behavior on W","rollback_reason":"regression","next_action_hint":"matvec micro-opts have small headroom (~5%). Try Add+RMSNorm fusion (saves dispatch+barrier+1 read pass) and ScalarMul+RMSNorm fusion (saves layer-boundary dispatch)."}}
{"run":9,"commit":"2613e30","metric":10.43,"metrics":{"prompt_tps":38.12,"wall_s":33.68,"encode_ms_per_tok":7.56,"wait_ms_per_tok":90.76},"status":"keep","description":"add encode/wait timing instrumentation (per-submit breakdown)","timestamp":1778517450658,"segment":0,"confidence":2.6575342465753433,"asi":{"hypothesis":"instrument decode to know whether CPU encoding or GPU waiting dominates","result":"encode 7.56ms (8%) vs wait 90.76ms (92%) per token — GPU work is the overwhelming bottleneck","implication":"kernel-fusion-to-reduce-dispatches has bounded headroom; need to reduce GPU work itself (better kernels, fewer redundant passes, less data movement). Big matvecs and many small ops both matter."}}
{"run":10,"commit":"2613e30","metric":10.41,"metrics":{"prompt_tps":23.83,"wall_s":39.11,"encode_ms_per_tok":8.11,"wait_ms_per_tok":91.86},"status":"discard","description":"AddRMSNorm fusion at attention→MLP boundary","timestamp":1778517666577,"segment":0,"confidence":1.98974358974359,"asi":{"hypothesis":"fusing Add+RMSNorm saves dispatch+barrier+one pass over hidden","result":"10.41 vs 10.43 baseline; wait_ms 91.86 vs 90.76 — no improvement, marginal regression","implication":"35 fewer dispatches/token does not move the needle. The bottleneck is NOT dispatch overhead. It must be either (a) large-matvec bandwidth, (b) per-kernel internal latency, or (c) the GPU not pipelining adjacent kernels. Output diverges slightly which suggests subtle numerical differences — the fused kernel reads carry from device after store, which might quantize bf16 (since bf16 → float → bf16 → float roundtrip).","rollback_reason":"no improvement, slight wait_ms regression","next_action_hint":"try kProj+vProj matvec fusion (small N=256 matvecs are likely latency-bound). Or add GPU timestamps to identify hot kernels."}}
{"run":11,"commit":"ceb6589","metric":10.38,"metrics":{"prompt_tps":38.72,"wall_s":32.29,"encode_ms_per_tok":7.01,"wait_ms_per_tok":91.74,"gpu_ms_per_tok":90.79},"status":"keep","description":"add GPU execution time tracking via MTL4 commit feedback","timestamp":1778517870918,"segment":0,"confidence":6.928571428571443,"asi":{"hypothesis":"decompose wait into GPU exec + scheduling overhead","result":"GPU 90.79 ms, wait 91.74 ms, scheduling overhead 0.95 ms. GPU IS the bottleneck.","bandwidth":"3.4 GB / 90.8 ms = 37 GB/s, vs M1 peak ~68 GB/s = 54% utilization","next_action_hint":"matvecs alone should take ~50 ms at peak bandwidth. 30 ms gap is in non-matvec kernels. Try big fusion of small kernels OR overlap independent kernels OR profile per-kernel-category."}}
{"run":12,"commit":"ceb6589","metric":10.39,"metrics":{"prompt_tps":12.22,"wall_s":23.49,"encode_ms_per_tok":11.07,"wait_ms_per_tok":92.86,"gpu_ms_per_tok":91.89},"status":"discard","description":"FusedKVCacheWrite: norm+rope+transpose+cache write as 1 kernel","timestamp":1778518109561,"segment":0,"confidence":11.757575757575689,"asi":{"hypothesis":"fusing 7 tiny K/V-path dispatches per layer (×24 layers = 168/token) cuts dispatch overhead","result":"GPU 91.89 vs 90.79 ms (slight regression), encode 11.07 vs 7.01 ms (extra encoding work for the new fused kernel's 5 bindings)","implication":"tiny-kernel dispatch overhead is NOT the bottleneck either. GPU bandwidth is the wall: 37 GB/s achieved vs ~50 GB/s realistic peak on M1. Matvec is near-bandwidth-bound.","rollback_reason":"no GPU time improvement, CPU encode time grew","next_action_hint":"either (a) reduce total weight bytes read per token (e.g. skip LogitSoftcap which is a no-op for argmax sampling), or (b) reorganize matvec to improve cache locality"}}
{"run":13,"commit":"ceb6589","metric":9.51,"metrics":{"prompt_tps":11.95,"wall_s":39.27,"encode_ms_per_tok":12.25,"wait_ms_per_tok":100.67,"gpu_ms_per_tok":99.8},"status":"discard","description":"stage x in TG memory for matvec_nk_simd4","timestamp":1778518257910,"segment":0,"confidence":6.928571428571443,"asi":{"hypothesis":"remove 4x redundant DRAM reads of x across simdgroups within a TG","result":"GPU 99.8 vs 90.79 ms — significant regression","likely_cause":"x was already L1/L2 cached so staging is pure overhead; the threadgroup_barrier adds latency; TG memory pressure may reduce SG occupancy","rollback_reason":"regression","next_action_hint":"matvec inner loop is tight; staging hurts. Try the opposite: cooperative w prefetch via simdgroup_async_copy. Or instead try fusing logits matvec + argmax (saves writes + LogitSoftcap)."}}
{"run":14,"commit":"ceb6589","metric":8.05,"metrics":{"prompt_tps":34.13,"wall_s":41.34,"encode_ms_per_tok":40.75,"wait_ms_per_tok":86.18,"gpu_ms_per_tok":85.44},"status":"discard","description":"DIAGNOSTIC: disable all barriers (output broken, measures barrier cost)","timestamp":1778518430809,"segment":0,"confidence":3.288135593220339,"asi":{"hypothesis":"measure how much GPU time is spent on barriers","result":"GPU 85.44 vs 90.79 ms = barriers cost ~5 ms / token (~5%). With ~1000 dispatches that's ~5 µs per barrier on M1.","implication":"fusion of dependent kernels can at best save ~5 ms total. Most GPU time is in actual kernel work (matvec bandwidth). The realistic ceiling for further fusion-based speedup is ~6%.","rollback_reason":"diagnostic only — broken output","next_action_hint":"matvec bandwidth IS the wall. Investigate the BIG matvecs: maybe a wider thread tile (TileM=2 or 4 fake-M) lets the matrix unit help, or store weights in a layout that prefetches better. Also try fusing argmax+softcap+matvec for logits to eliminate the 1MB write."}}
{"run":15,"commit":"ceb6589","metric":10.37,"metrics":{"prompt_tps":11.81,"wall_s":41.69,"encode_ms_per_tok":12.18,"wait_ms_per_tok":92.15,"gpu_ms_per_tok":91.18},"status":"discard","description":"matvec simd16 (16 rows/sg) for N>=65536 (logits only)","timestamp":1778518553366,"segment":0,"confidence":6.928571428571443,"asi":{"hypothesis":"fewer simdgroups + more rows amortizes SG overhead for huge-N","result":"neutral (10.37 ≈ 10.38)","implication":"logits matvec already near optimal with simd4. Register pressure from 16 accumulators doesn't help. Bandwidth bound dominates.","rollback_reason":"no improvement","next_action_hint":"current matvec is near optimal in its kernel design. Real wins would come from changing W memory layout for better cache locality (interleaved 4-row chunks) or reducing total weight bytes (which we can't without quantization)."}}
{"run":16,"commit":"d6c6e8d","metric":10.51,"metrics":{"prompt_tps":46.36,"wall_s":32.18,"encode_ms_per_tok":5.35,"wait_ms_per_tok":91.78,"gpu_ms_per_tok":90.88},"status":"keep","description":"skip no-op Transpose12 for t=1 (q,k,v,attn output) + SwigluMatvec fusion","timestamp":1778518773344,"segment":0,"confidence":9.395348837209268,"asi":{"hypothesis":"Transpose12 of [B,T,Nh,Hd]->[B,Nh,T,Hd] is identity when T=1; skip 4 dispatches per layer in decode","result":"10.51 vs 10.38 (+1.3%), output identical, encode_ms 5.35 vs 7.01 (saved 1.7 ms CPU)","implication":"real but small win on CPU encode side. GPU time unchanged — the Transpose12 dispatches that were eliminated were almost zero-cost on GPU.","next_action_hint":"more no-ops? RopeApply for K cache only writes 1 head's worth at decode; can write directly into KV cache with RoPE inline (skip kNorm/vNorm intermediate buffers and Transpose). Less feasible since norm+rope is real work. Or look for similar layout-coincidence skips."}}
{"run":17,"commit":"96a15d0","metric":10.57,"metrics":{"prompt_tps":44.6,"wall_s":37.54,"encode_ms_per_tok":5.2,"wait_ms_per_tok":91.51,"gpu_ms_per_tok":90.56},"status":"keep","description":"skip RowSlice2D (identity for t=1) and LogitSoftcap (monotonic for argmax)","timestamp":1778518858086,"segment":0,"confidence":9.90476190476195,"asi":{"hypothesis":"two more no-op dispatches per token","result":"10.57 vs 10.51 (+0.6%), GPU 90.56 vs 90.88 (-0.3 ms), output identical","implication":"small but real. LogitSoftcap was reading+writing all 262k logits (~2 MB IO) for no reason at decode.","next_action_hint":"more skips? Check small kernels in PLE block that might be no-ops at t=1. Or look at the FUSED hot path: end-of-MLP Add+RMSNorm; ScalarMul+(next layer's RMSNorm)."}}
{"run":18,"commit":"96a15d0","metric":7.76,"metrics":{"prompt_tps":35.69,"wall_s":40.5,"encode_ms_per_tok":37.45,"wait_ms_per_tok":93.95,"gpu_ms_per_tok":93.22},"status":"discard","description":"DIAGNOSTIC: force barrier between every dispatch","timestamp":1778519314563,"segment":0,"confidence":7.298245614035062,"asi":{"hypothesis":"measure benefit of Apple GPU's implicit kernel concurrency for non-conflicting kernels","result":"GPU 93.22 vs 90.56 ms normal vs 85.44 ms no-barriers. Concurrency saves only ~3 ms; barriers cost ~5 ms total. Both are small.","implication":"non-matvec budget is mostly real per-kernel work, not pipeline waste. Fusion ceiling is ~5%. Time to accept the matvec bandwidth wall.","rollback_reason":"diagnostic only — forced barriers regress perf","next_action_hint":"current state (10.57 tok/s on M1) is near-optimal without changing weight precision or layout. To reach 13 tok/s would require ICBs (overlap CPU encode with GPU exec) and/or weight repacking for better cache locality."}}
{"run":19,"commit":"96a15d0","metric":10.38,"metrics":{"prompt_tps":23.28,"wall_s":38.94,"encode_ms_per_tok":7.56,"wait_ms_per_tok":92.82,"gpu_ms_per_tok":91.99},"status":"discard","description":"pipeline descriptor with threadGroupSizeIsMultipleOfThreadExecutionWidth=true + maxTotalThreadsPerThreadgroup hints","timestamp":1778519511369,"segment":0,"confidence":9.90476190476195,"asi":{"hypothesis":"compiler hints (max TG size + multiple-of-32 guarantee) free up registers and skip bounds checks","result":"regressed 10.57 → 10.38 (GPU 91.99 vs 90.56)","likely_cause":"the maxTotalThreadsPerThreadgroup hints may have forced more registers per thread for kernels where it didn't help, hurting occupancy. Or the bounds-check skip is moot because compiler already inlines them.","rollback_reason":"regression","next_action_hint":"try storageModeShared + hazardTrackingModeUntracked on workspace/weight buffers (we already manually manage hazards via HazardTrackingEncoder; the default tracking is wasted overhead). Also try threadGroupSizeIsMultipleOfThreadExecutionWidth alone without the max threads hint."}}
{"run":20,"commit":"adcb4b8","metric":10.58,"metrics":{"prompt_tps":43.66,"wall_s":29.73,"encode_ms_per_tok":5.11,"wait_ms_per_tok":91.53,"gpu_ms_per_tok":90.61},"status":"keep","description":"hazard-tracking off + skip didModifyRange on shared constant pages + untracked tensor buffers","timestamp":1778519788779,"segment":0,"confidence":9.952380952380953,"asi":{"hypothesis":"we explicitly manage hazards via HazardTrackingEncoder; the default automatic tracking is wasted overhead. didModifyRange is a no-op on shared storage but still has call cost.","result":"10.58 vs 10.57 (tiny but consistent); GPU 90.61 ms ~unchanged","implication":"automatic hazard tracking has near-zero cost on M1 with MTL4 — the framework already trusts our explicit barriers. Still a correctness/clarity improvement.","next_action_hint":"look at other Metal flags: cooperative tensors, function-constant specialization for known sizes (N, K), or shaderValidation off"}}
{"run":21,"commit":"3c9ca20","metric":10.59,"metrics":{"prompt_tps":47.38,"wall_s":39.56,"encode_ms_per_tok":4.87,"wait_ms_per_tok":91.51,"gpu_ms_per_tok":90.57},"status":"keep","description":"pipeline hint: threadGroupSizeIsMultipleOfThreadExecutionWidth=true","timestamp":1778519865151,"segment":0,"confidence":9.999999999999957,"asi":{"hypothesis":"tell the compiler all threadgroup widths are multiples of 32 so it can elide tail-wave bounds checks","result":"10.59 vs 10.58 (+0.1%), GPU 90.57 ms ~unchanged; encode 4.87 vs 5.11 (-5%) — small but real","implication":"tiny win, mostly on CPU side","next_action_hint":"try function constants for matvec K (a handful of distinct K values in Gemma); compiler could unroll inner loop. Or look at MTLLibrary preloadFunctions / fastMathEnabled."}}
{"run":22,"commit":"3c9ca20","metric":10.5,"metrics":{"prompt_tps":17.11,"wall_s":39.47,"encode_ms_per_tok":8.75,"wait_ms_per_tok":91.94,"gpu_ms_per_tok":91.1},"status":"discard","description":"K-specialized matvec kernels for K=1536, K=6144","timestamp":1778520050694,"segment":0,"confidence":10.49999999999999,"asi":{"hypothesis":"K known at compile time lets compiler unroll inner loop, hide load-fma latency","result":"10.50 vs 10.59 — slight regression; GPU 91.10 vs 90.57 ms","implication":"Metal compiler already optimizes well even when K is a uniform constant buffer value. Manual specialization doesn't help and adds binary bloat.","rollback_reason":"regression","next_action_hint":"explore residency set with stricter usage hints, or buffer prefetching via setPurgeableState. Or revisit Indirect Command Buffers."}}
{"run":23,"commit":"3c9ca20","metric":10.55,"metrics":{"prompt_tps":41.21,"wall_s":41.06,"encode_ms_per_tok":5.26,"wait_ms_per_tok":91.77,"gpu_ms_per_tok":90.92},"status":"discard","description":"explicit shaderValidation = .disabled on pipeline descriptor","timestamp":1778520175398,"segment":0,"confidence":11.052631578947395,"asi":{"hypothesis":"shader validation might be enabled by default","result":"10.55 vs 10.59 (within noise)","implication":"shader validation already off in release builds. No-op.","rollback_reason":"no improvement"}}
{"run":24,"commit":"3c9ca20","metric":10.58,"metrics":{"prompt_tps":38.62,"wall_s":40.12,"encode_ms_per_tok":5.09,"wait_ms_per_tok":91.85,"gpu_ms_per_tok":91.01},"status":"discard","description":"share one argument table across all dispatches (no per-kernel allocation)","timestamp":1778520258284,"segment":0,"confidence":10.7692307692308,"asi":{"hypothesis":"argument table allocation/binding has per-kernel overhead","result":"10.58 vs 10.59 (within noise); output identical so MTL4 captures bindings at dispatchThreads time as expected","implication":"argument table pool was already cheap; dispatchThreads correctly snapshots bindings, so sharing works. No measurable speedup. CONFIRMED: argument table reuse is safe in MTL4.","rollback_reason":"no improvement"}}
{"run":25,"commit":"3c9ca20","metric":10.59,"metrics":{"prompt_tps":41.62,"wall_s":32.6,"encode_ms_per_tok":5.03,"wait_ms_per_tok":91.61,"gpu_ms_per_tok":90.69},"status":"discard","description":"switch GPU-only workspace + KV-cache buffers to storageModePrivate","timestamp":1778520387113,"segment":0,"confidence":10.500000000000036,"asi":{"hypothesis":"private storage avoids CPU/GPU coherency overhead at command-buffer boundaries","result":"10.59 = current best, no measurable change; GPU 90.69 ms ~unchanged","implication":"on Apple's unified memory, private vs shared has zero perf difference — the memory IS the same DRAM. Only relevant on discrete GPUs.","rollback_reason":"no improvement (also adds code complexity for no benefit)"}}
{"run":26,"commit":"3c9ca20","metric":10.46,"metrics":{"prompt_tps":44.49,"wall_s":33.09,"encode_ms_per_tok":4.47,"wait_ms_per_tok":93.26,"gpu_ms_per_tok":92.18},"status":"discard","description":"docs only: update autoresearch.md with full findings","timestamp":1778520518262,"segment":0,"confidence":10.7692307692308,"asi":{"hypothesis":"no code changes; documenting current state","result":"10.46 vs 10.59 — just measurement noise (system was warmer or busier this run)","rollback_reason":"noise variation; docs preserved by autoresearch since .md is in the protected set"}}
