{"run":27,"commit":"3c9ca20","metric":10.49,"metrics":{"prompt_tps":39.24,"wall_s":31.65,"encode_ms_per_tok":4.77,"wait_ms_per_tok":92.88,"gpu_ms_per_tok":91.99},"status":"discard","description":"larger TG=256 (8 SGs) for matvec when N>=1024","timestamp":1778520710682,"segment":0,"confidence":11.052631578947395,"asi":{"hypothesis":"more SGs per TG amortizes x-cache load","result":"10.49 vs 10.59 — regression. Larger TG means fewer TGs total, possibly under-utilizing scheduling.","rollback_reason":"regression"}}
{"run":35,"commit":"32afc8f","metric":0,"metrics":{"prompt_tps":0,"wall_s":0,"encode_ms_per_tok":0,"wait_ms_per_tok":0,"gpu_ms_per_tok":0},"status":"crash","description":"GPU stuck in error state after pipelining attempt; code is the 10.71 best state","timestamp":1778524175553,"segment":0,"confidence":14.799999999999969,"asi":{"hypothesis":"after the previous pipelining experiment that hit MTL4CommandQueueErrorTimeout, the macOS GPU driver / IOAccel stayed in an error state across subsequent runs","result":"every run since then has hit the same MTL4 error after the prefill prints 'The capital of Ireland is'. Same on older commit without SDPA fused.","implication":"code on disk is correct (matches the 10.71 SDPA-fused state). The hang is system-side; a reboot or `sudo killall WindowServer` may be needed to recover. NOT a code regression.","rollback_reason":"system GPU failure, not code"}}
